{"asset_set_digest":"sha256:21e68b89466702a19cbaf4213f8927ba52498ab14ca21e67aec17d9c60ba7eab","benchmark_compatibility":[{"condition_id":"adaptive_ask","config_digest":"sha256:2316e45161ec9e39870cc8ea00e37c46cce55ef98997af9c854550e9a73b37e3","config_path":"benchmarks/adaptive-portfolio.config.json","frozen_results_mutated":false}],"budgets":{"exceeded_action":"stop","policy_limits":{"cost_microunits":{"maximum":null,"status":"unbounded"},"duration_ms":{"maximum":null,"status":"unbounded"},"token_count":{"maximum":null,"status":"unbounded"}},"unknown_value_action":"bypass"},"entries":[{"activation_requirement":"portfolio_activation","asset":{"asset_type":"prompt","content_digest":"sha256:d89ac64c6b863068939aef479e324542c9b9c0150d3d37373467d81d6d7bcc84","record_digest":"sha256:9c93cb116df6bf61e855fc8d24fd26116acedbceaabae9a8b8d7fb5185ab6d78","stable_id":"ask.prompt-template.issue278.evolution-sample","version":"278.0.0-candidate"},"assurance_lane":"challenger","cost_estimate":{"cost_microunits":{"status":"known","value":10},"duration_ms":{"status":"known","value":10},"token_count":{"status":"known","value":10}},"entry_id":"sample-candidate-canary","evidence_requirement_ids":["issue-278-sample-canary-evidence"],"expected_registry_state":"candidate","expected_scope_id":"agent-spectrum-kernel","exposure":{"canary_percent":10,"mode":"canary"},"failure_actions":{"capability_missing":"downgrade","evidence_conflict":"stop","evidence_missing":"bypass","evidence_stale":"downgrade","inapplicable":"bypass","prohibited_task":"stop","safety_unknown":"downgrade"},"prohibited_task_classes":[],"role":"challenger","selectors":{"adapters":{"excluded":[],"included":["codex"],"status":"bounded"},"capabilities":{"excluded":[],"included":["repository.read"],"status":"bounded"},"domains":{"excluded":[],"included":["software-engineering"],"status":"bounded"},"models":{"excluded":[],"included":["gpt-5.6-sol"],"status":"bounded"},"projects":{"excluded":[],"included":["github.com/ist-h-i/agent-spectrum-kernel"],"status":"bounded"},"risk_classes":{"excluded":[],"included":["normal"],"status":"bounded"},"stacks":{"excluded":[],"included":["node"],"status":"bounded"},"task_classes":{"excluded":[],"included":["implementation"],"status":"bounded"}}}],"evidence_requirements":[{"allowed_dispositions":["reuse_exact"],"entry_ids":["sample-candidate-canary"],"required_current_state_refs":[{"state_digest":"sha256:cba765f764e2ccfef249d00bb85771f0282ab2c873c2fa63a86e3f351cc1b087","state_id":"repository-tree"}],"requirement_id":"issue-278-sample-canary-evidence","requirements":{"planner_scope":"exact_only","program":"ask_verification_requirements","required_gates":[{"authority":{"accepted_evidence_levels":["behavior_verified"],"accepted_producers":[{"identity_digest":"sha256:f62fd99583239e66683bb31ef76e84b09247ee641e350d68e1e84b79822bd3e9","kind":"developer"}],"independent_judgment_required":false},"execution_availability":"available","gate_id":"issue-278-sample-canary-gate","required_obligation_refs":["issue-278-sample-canary.contract-mechanics-only"],"reuse_identity":{"consumed_inputs":[{"digest":"sha256:e5ce1af9c7668078ba51581cf48ca82c5ab03675393a81d827856e3241b2f0bf","kind":"manifest","path":"portfolio-selection-basis.json"}],"execution":{"command":{"argument_count":1,"argument_identity_scheme":"opaque-references-v1","arguments_digest":"sha256:647ef924798f8a047f3a21dd9332e38a9795c7584328cb2e5afe774b92307897","executable":"node","opaque_argument_count":0,"working_directory":"."},"environment":{"architecture":"portable","identity_digest":"sha256:6c6c1dde708c2338a6a7948a6295ea276298296b49ce6a9c107e7461349aa823","os":"portable"},"runner":{"adapter_id":"codex","adapter_version":"1.0.0","evidence_level":"behavior_verified","runner_id":"issue-278-local-fixture","runner_version":"1.0.0"},"toolchain":[{"identity_digest":"sha256:47c1ac31e947ac9d179165b06473fbb8ddcb105d33cdeb6d687ecb7f2999bbf7","name":"node","version":"24"}]},"gate":{"category":"test","contract_digest":"sha256:9baee01263481710c70216848f81cd637eef6c11cc5c9fdcfaf60da0ebe7cce1","gate_id":"issue-278-sample-canary-gate"},"target":{"repository_id":"github.com/ist-h-i/agent-spectrum-kernel","target_revision":"58b21338c0378a2f8ea8e955979eaa5041ac098e","tree_digest":"sha256:cba765f764e2ccfef249d00bb85771f0282ab2c873c2fa63a86e3f351cc1b087"}},"reuse_identity_digest":"sha256:8fcbb5bd5375347e72e27b2273394c36aa92a2142b5160ba0b60e1af2ae5f18b"}],"requirements_digest":"sha256:f8c3441cb95a005dc2fd2fc8143a27c11effc6ca7e35a1e36a65046fc8475735","requirements_id":"verification-requirements-f8c3441cb95a005dc2fd2fc8143a27c11effc6ca7e35a1e36a65046fc8475735","schema_path":"schemas/verification-reuse-plan.schema.json","schema_version":"1.0.0","target":{"repository_id":"github.com/ist-h-i/agent-spectrum-kernel","target_revision":"58b21338c0378a2f8ea8e955979eaa5041ac098e","tree_digest":"sha256:cba765f764e2ccfef249d00bb85771f0282ab2c873c2fa63a86e3f351cc1b087"}}}],"kernel_foundation":{"content_digest":"sha256:a7ff72897b758c166cbf7b41bb91b8f92998af408d3275ca09f98656bbb711eb","kind":"canonical_kernel","source_path":"AGENTS.md","source_revision":"58b21338c0378a2f8ea8e955979eaa5041ac098e"},"object_kind":"portfolio_manifest","portfolio_id":"ask.portfolio.issue278.sample-runtime","registry":{"registry_id":"ask-local-assets","repository_id":"github.com/ist-h-i/agent-spectrum-kernel","scope_id":"agent-spectrum-kernel","snapshot_digest":"sha256:bed19f2c11e147262fb211ff162c590834f1f1d5f40f66b8e0a12e1caed4f801","snapshot_revision":6},"repository_id":"github.com/ist-h-i/agent-spectrum-kernel","revision":"sample-candidate-canary-v2","rollback":{"mode":"exact","required_authority_kind":"external_portfolio_rollback_authority","target":{"asset_set_digest":"sha256:06ef54d6a0516d07d2b058a08b8a291d37f8e884bdb2ba6a924661776e8fb460","manifest_digest":"sha256:f7be1b013f6e96041848e63388aeba6e72786f3dcb31cc9f21b0282a3e01aa21","portfolio_id":"ask.portfolio.issue278.sample-runtime","revision":"sample-baseline-v1"}},"safety_guardrails":{"high_impact_without_approval_action":"stop","prohibited_effects":[],"unknown_safety_action":"downgrade"},"schema_version":"1.0.0","scope_id":"agent-spectrum-kernel","selection_basis_digest":"sha256:e5ce1af9c7668078ba51581cf48ca82c5ab03675393a81d827856e3241b2f0bf","selection_context_allowlist":{"adapters":["codex"],"capabilities":["repository.read"],"domains":["software-engineering"],"models":["gpt-5.6-sol"],"operation_scopes":["local_repository"],"projects":["github.com/ist-h-i/agent-spectrum-kernel"],"risk_classes":["normal"],"stacks":["node"],"task_classes":["implementation"]},"selection_policy":{"empty_selection_action":"stop","portfolio_inapplicable_action":"bypass","selector_conflict_action":"stop"},"selectors":{"adapters":{"excluded":[],"included":["codex"],"status":"bounded"},"capabilities":{"excluded":[],"included":["repository.read"],"status":"bounded"},"domains":{"excluded":[],"included":["software-engineering"],"status":"bounded"},"models":{"excluded":[],"included":["gpt-5.6-sol"],"status":"bounded"},"projects":{"excluded":[],"included":["github.com/ist-h-i/agent-spectrum-kernel"],"status":"bounded"},"risk_classes":{"excluded":[],"included":["normal"],"status":"bounded"},"stacks":{"excluded":[],"included":["node"],"status":"bounded"},"task_classes":{"excluded":[],"included":["implementation"],"status":"bounded"}},"source_revision":"58b21338c0378a2f8ea8e955979eaa5041ac098e","unresolved_conflicts":[]}
