{"asset_set_digest":"sha256:4f53cda18c2baa0c0354bb5f9a3ecbe5ed12ab4d8e11ba873c2f11161202b945","benchmark_compatibility":[{"condition_id":"kernel_only","config_digest":"sha256:2316e45161ec9e39870cc8ea00e37c46cce55ef98997af9c854550e9a73b37e3","config_path":"benchmarks/adaptive-portfolio.config.json","frozen_results_mutated":false}],"budgets":{"exceeded_action":"stop","policy_limits":{"cost_microunits":{"maximum":null,"status":"unbounded"},"duration_ms":{"maximum":null,"status":"unbounded"},"token_count":{"maximum":null,"status":"unbounded"}},"unknown_value_action":"downgrade"},"entries":[],"evidence_requirements":[],"kernel_foundation":{"content_digest":"sha256:a7ff72897b758c166cbf7b41bb91b8f92998af408d3275ca09f98656bbb711eb","kind":"canonical_kernel","source_path":"AGENTS.md","source_revision":"c24f459b0bf69a755dfde00719516e4a5844018d"},"object_kind":"portfolio_manifest","portfolio_id":"ask.portfolio.reference","registry":{"registry_id":"ask-local-assets","repository_id":"github.com/ist-h-i/agent-spectrum-kernel","scope_id":"agent-spectrum-kernel","snapshot_digest":"sha256:5b50712f43feecf82d532178310cf2e0fe2fe709e0d951eb797a3876ff0cf92d","snapshot_revision":4},"repository_id":"github.com/ist-h-i/agent-spectrum-kernel","revision":"reference-kernel-only-v1","rollback":{"mode":"none","required_authority_kind":"external_portfolio_rollback_authority","target":null},"safety_guardrails":{"high_impact_without_approval_action":"stop","prohibited_effects":[],"unknown_safety_action":"downgrade"},"schema_version":"1.0.0","scope_id":"agent-spectrum-kernel","selection_basis_digest":"sha256:ac9fcfa5d64503c67ed157d88ce5bc80fef8611882c2307456ce466fd9b80b16","selection_context_allowlist":{"adapters":["codex"],"capabilities":["local_filesystem"],"domains":["ai-engineering"],"models":["gpt-5.6-sol"],"operation_scopes":["automatic_portfolio_activation","local_repository"],"projects":["github.com/ist-h-i/agent-spectrum-kernel"],"risk_classes":["ordinary"],"stacks":["node"],"task_classes":["implementation","risk-gated-production"]},"selection_policy":{"empty_selection_action":"bypass","portfolio_inapplicable_action":"stop","selector_conflict_action":"stop"},"selectors":{"adapters":{"excluded":[],"included":["codex"],"status":"bounded"},"capabilities":{"excluded":[],"included":["local_filesystem"],"status":"bounded"},"domains":{"excluded":[],"included":["ai-engineering"],"status":"bounded"},"models":{"excluded":[],"included":["gpt-5.6-sol"],"status":"bounded"},"projects":{"excluded":[],"included":["github.com/ist-h-i/agent-spectrum-kernel"],"status":"bounded"},"risk_classes":{"excluded":[],"included":["ordinary"],"status":"bounded"},"stacks":{"excluded":[],"included":["node"],"status":"bounded"},"task_classes":{"excluded":[],"included":["implementation"],"status":"bounded"}},"source_revision":"c24f459b0bf69a755dfde00719516e4a5844018d","unresolved_conflicts":[]}
