{"asset_set_digest":"sha256:346873c682a7f2168407145e68f6cbfe36840adb1e656924c809e10fde03fdfa","benchmark_compatibility":[{"condition_id":"full_ask","config_digest":"sha256:898d0f45e10c6e4951d04000a735b772d6d4c32482b15effc952226ff5e440c2","config_path":"benchmarks/prompt-v2-preregistration.json","frozen_results_mutated":false}],"budgets":{"exceeded_action":"stop","policy_limits":{"cost_microunits":{"maximum":null,"status":"unbounded"},"duration_ms":{"maximum":null,"status":"unbounded"},"token_count":{"maximum":null,"status":"unbounded"}},"unknown_value_action":"stop"},"entries":[{"activation_requirement":"portfolio_activation","asset":{"asset_type":"prompt","content_digest":"sha256:1fec5fb3550f17f7ef463d00eac53e34124c251f036a8808ea87e7d1347dc348","record_digest":"sha256:81815fd22afae413217b241a65c9b8d7a7068bc703c33967c1a45c0824a4c80f","stable_id":"ask.prompt-bundle.codex","version":"234.0.0-current"},"assurance_lane":"exploratory","cost_estimate":{"cost_microunits":{"status":"known","value":0},"duration_ms":{"status":"known","value":1},"token_count":{"status":"known","value":1}},"entry_id":"codex-baseline-prompt-bundle","evidence_requirement_ids":[],"expected_registry_state":"candidate","expected_scope_id":"agent-spectrum-kernel","exposure":{"canary_percent":null,"mode":"shadow"},"failure_actions":{"capability_missing":"stop","evidence_conflict":"stop","evidence_missing":"stop","evidence_stale":"stop","inapplicable":"stop","prohibited_task":"stop","safety_unknown":"stop"},"prohibited_task_classes":[],"role":"experimental","selectors":{"adapters":{"excluded":[],"included":["codex"],"status":"bounded"},"capabilities":{"excluded":[],"included":["prompt_v2_exact_projection"],"status":"bounded"},"domains":{"excluded":[],"included":["ai_engineering"],"status":"bounded"},"models":{"excluded":[],"included":["gpt-5.6-sol"],"status":"bounded"},"projects":{"excluded":[],"included":["github.com/ist-h-i/agent-spectrum-kernel"],"status":"bounded"},"risk_classes":{"excluded":[],"included":["ordinary"],"status":"bounded"},"stacks":{"excluded":[],"included":["prompt_v2_preregistration"],"status":"bounded"},"task_classes":{"excluded":[],"included":["verification"],"status":"bounded"}}}],"evidence_requirements":[],"kernel_foundation":{"content_digest":"sha256:8bbf593c2bb64e98803d486e3f0ff722a60b40d28107ddac1d69fc69b74dc4b3","kind":"canonical_kernel","source_path":"AGENTS.md","source_revision":"1710b3007d60e249d553ca7a43b5a83937066b61"},"object_kind":"portfolio_manifest","portfolio_id":"ask.portfolio.prompt-v2.codex","registry":{"registry_id":"ask-local-assets","repository_id":"github.com/ist-h-i/agent-spectrum-kernel","scope_id":"agent-spectrum-kernel","snapshot_digest":"sha256:d4f1962245e57fdbadf098dc959f49130e7f97ecb888d13d306a82338df05bfa","snapshot_revision":11},"repository_id":"github.com/ist-h-i/agent-spectrum-kernel","revision":"prompt-v2-baseline-v1","rollback":{"mode":"none","required_authority_kind":"external_portfolio_rollback_authority","target":null},"safety_guardrails":{"high_impact_without_approval_action":"stop","prohibited_effects":[],"unknown_safety_action":"stop"},"schema_version":"1.0.0","scope_id":"agent-spectrum-kernel","selection_basis_digest":"sha256:e007df72382bd2289a48bd71643ebe1277040d9a0fa59d162ceaa937848a84ad","selection_context_allowlist":{"adapters":["codex"],"capabilities":["prompt_v2_exact_projection"],"domains":["ai_engineering"],"models":["gpt-5.6-sol"],"operation_scopes":["automatic_portfolio_activation","measured_prompt_v2_execution","prompt_v2_preregistration"],"projects":["github.com/ist-h-i/agent-spectrum-kernel"],"risk_classes":["ordinary"],"stacks":["prompt_v2_preregistration"],"task_classes":["implementation","review","verification"]},"selection_policy":{"empty_selection_action":"stop","portfolio_inapplicable_action":"stop","selector_conflict_action":"stop"},"selectors":{"adapters":{"excluded":[],"included":["codex"],"status":"bounded"},"capabilities":{"excluded":[],"included":["prompt_v2_exact_projection"],"status":"bounded"},"domains":{"excluded":[],"included":["ai_engineering"],"status":"bounded"},"models":{"excluded":[],"included":["gpt-5.6-sol"],"status":"bounded"},"projects":{"excluded":[],"included":["github.com/ist-h-i/agent-spectrum-kernel"],"status":"bounded"},"risk_classes":{"excluded":[],"included":["ordinary"],"status":"bounded"},"stacks":{"excluded":[],"included":["prompt_v2_preregistration"],"status":"bounded"},"task_classes":{"excluded":[],"included":["verification"],"status":"bounded"}},"source_revision":"1710b3007d60e249d553ca7a43b5a83937066b61","unresolved_conflicts":[]}
