{"asset_set_digest":"sha256:f2ed4f5c784cd8778324b1eaab970fa2ea351785a89e9957cb3c318fed307adc","benchmark_compatibility":[{"condition_id":"adaptive_ask","config_digest":"sha256:898d0f45e10c6e4951d04000a735b772d6d4c32482b15effc952226ff5e440c2","config_path":"benchmarks/prompt-v2-preregistration.json","frozen_results_mutated":false}],"budgets":{"exceeded_action":"stop","policy_limits":{"cost_microunits":{"maximum":null,"status":"unbounded"},"duration_ms":{"maximum":null,"status":"unbounded"},"token_count":{"maximum":null,"status":"unbounded"}},"unknown_value_action":"stop"},"entries":[{"activation_requirement":"portfolio_activation","asset":{"asset_type":"prompt","content_digest":"sha256:42f463a383ede4690b0ed9dc0925388a9cc2f6d7cec944932d07e25103423f59","record_digest":"sha256:5ea73fbbe3ca75707c8328a5d2fe5723c94f681db67c528b35d33b501cd44e4a","stable_id":"ask.prompt-bundle.claude","version":"234.0.0-prompt-v2"},"assurance_lane":"exploratory","cost_estimate":{"cost_microunits":{"status":"known","value":0},"duration_ms":{"status":"known","value":1},"token_count":{"status":"known","value":1}},"entry_id":"claude-challenger-prompt-bundle","evidence_requirement_ids":[],"expected_registry_state":"candidate","expected_scope_id":"agent-spectrum-kernel","exposure":{"canary_percent":null,"mode":"shadow"},"failure_actions":{"capability_missing":"stop","evidence_conflict":"stop","evidence_missing":"stop","evidence_stale":"stop","inapplicable":"stop","prohibited_task":"stop","safety_unknown":"stop"},"prohibited_task_classes":[],"role":"experimental","selectors":{"adapters":{"excluded":[],"included":["claude_code"],"status":"bounded"},"capabilities":{"excluded":[],"included":["prompt_v2_exact_projection"],"status":"bounded"},"domains":{"excluded":[],"included":["ai_engineering"],"status":"bounded"},"models":{"excluded":[],"included":["unavailable"],"status":"bounded"},"projects":{"excluded":[],"included":["github.com/ist-h-i/agent-spectrum-kernel"],"status":"bounded"},"risk_classes":{"excluded":[],"included":["ordinary"],"status":"bounded"},"stacks":{"excluded":[],"included":["prompt_v2_preregistration"],"status":"bounded"},"task_classes":{"excluded":[],"included":["verification"],"status":"bounded"}}}],"evidence_requirements":[],"kernel_foundation":{"content_digest":"sha256:8bbf593c2bb64e98803d486e3f0ff722a60b40d28107ddac1d69fc69b74dc4b3","kind":"canonical_kernel","source_path":"AGENTS.md","source_revision":"1710b3007d60e249d553ca7a43b5a83937066b61"},"object_kind":"portfolio_manifest","portfolio_id":"ask.portfolio.prompt-v2.claude","registry":{"registry_id":"ask-local-assets","repository_id":"github.com/ist-h-i/agent-spectrum-kernel","scope_id":"agent-spectrum-kernel","snapshot_digest":"sha256:d4f1962245e57fdbadf098dc959f49130e7f97ecb888d13d306a82338df05bfa","snapshot_revision":11},"repository_id":"github.com/ist-h-i/agent-spectrum-kernel","revision":"prompt-v2-challenger-v1","rollback":{"mode":"exact","required_authority_kind":"external_portfolio_rollback_authority","target":{"asset_set_digest":"sha256:683f6c70f79d1fe4f63bb0480e1ab6e3c963323819e58b3ed9a85af8d4c9961c","manifest_digest":"sha256:46e3541f78aae65223dad8779164ad227e2c388a906ba52ea72cf99b76e99641","portfolio_id":"ask.portfolio.prompt-v2.claude","revision":"prompt-v2-baseline-v1"}},"safety_guardrails":{"high_impact_without_approval_action":"stop","prohibited_effects":[],"unknown_safety_action":"stop"},"schema_version":"1.0.0","scope_id":"agent-spectrum-kernel","selection_basis_digest":"sha256:031cb4d543c94ef0c8f2a675e5e49eec1cbff445f2fe6c8a14c1bf9373fe6438","selection_context_allowlist":{"adapters":["claude_code"],"capabilities":["prompt_v2_exact_projection"],"domains":["ai_engineering"],"models":["unavailable"],"operation_scopes":["automatic_portfolio_activation","measured_prompt_v2_execution","prompt_v2_preregistration"],"projects":["github.com/ist-h-i/agent-spectrum-kernel"],"risk_classes":["ordinary"],"stacks":["prompt_v2_preregistration"],"task_classes":["implementation","review","verification"]},"selection_policy":{"empty_selection_action":"stop","portfolio_inapplicable_action":"stop","selector_conflict_action":"stop"},"selectors":{"adapters":{"excluded":[],"included":["claude_code"],"status":"bounded"},"capabilities":{"excluded":[],"included":["prompt_v2_exact_projection"],"status":"bounded"},"domains":{"excluded":[],"included":["ai_engineering"],"status":"bounded"},"models":{"excluded":[],"included":["unavailable"],"status":"bounded"},"projects":{"excluded":[],"included":["github.com/ist-h-i/agent-spectrum-kernel"],"status":"bounded"},"risk_classes":{"excluded":[],"included":["ordinary"],"status":"bounded"},"stacks":{"excluded":[],"included":["prompt_v2_preregistration"],"status":"bounded"},"task_classes":{"excluded":[],"included":["verification"],"status":"bounded"}},"source_revision":"1710b3007d60e249d553ca7a43b5a83937066b61","unresolved_conflicts":[]}
