{"asset_set_digest":"sha256:2e39061606b95f53b482e4aedf368f555d5e5be3f4a63eddc19e81e87006f963","benchmark_compatibility":[{"condition_id":"adaptive_ask","config_digest":"sha256:2316e45161ec9e39870cc8ea00e37c46cce55ef98997af9c854550e9a73b37e3","config_path":"benchmarks/adaptive-portfolio.config.json","frozen_results_mutated":false}],"budgets":{"exceeded_action":"stop","policy_limits":{"cost_microunits":{"maximum":null,"status":"unbounded"},"duration_ms":{"maximum":null,"status":"unbounded"},"token_count":{"maximum":null,"status":"unbounded"}},"unknown_value_action":"bypass"},"entries":[{"activation_requirement":"portfolio_activation","asset":{"asset_type":"prompt","content_digest":"sha256:d89ac64c6b863068939aef479e324542c9b9c0150d3d37373467d81d6d7bcc84","record_digest":"sha256:9c93cb116df6bf61e855fc8d24fd26116acedbceaabae9a8b8d7fb5185ab6d78","stable_id":"ask.prompt-template.issue278.evolution-sample","version":"278.0.0-candidate"},"assurance_lane":"exploratory","cost_estimate":{"cost_microunits":{"status":"known","value":10},"duration_ms":{"status":"known","value":10},"token_count":{"status":"known","value":10}},"entry_id":"sample-challenger-prompt","evidence_requirement_ids":[],"expected_registry_state":"candidate","expected_scope_id":"agent-spectrum-kernel","exposure":{"canary_percent":null,"mode":"shadow"},"failure_actions":{"capability_missing":"downgrade","evidence_conflict":"stop","evidence_missing":"bypass","evidence_stale":"downgrade","inapplicable":"bypass","prohibited_task":"stop","safety_unknown":"downgrade"},"prohibited_task_classes":[],"role":"experimental","selectors":{"adapters":{"excluded":[],"included":["codex"],"status":"bounded"},"capabilities":{"excluded":[],"included":["repository.read"],"status":"bounded"},"domains":{"excluded":[],"included":["software-engineering"],"status":"bounded"},"models":{"excluded":[],"included":["gpt-5.6-sol"],"status":"bounded"},"projects":{"excluded":[],"included":["github.com/ist-h-i/agent-spectrum-kernel"],"status":"bounded"},"risk_classes":{"excluded":[],"included":["normal"],"status":"bounded"},"stacks":{"excluded":[],"included":["node"],"status":"bounded"},"task_classes":{"excluded":[],"included":["implementation"],"status":"bounded"}}}],"evidence_requirements":[],"kernel_foundation":{"content_digest":"sha256:a7ff72897b758c166cbf7b41bb91b8f92998af408d3275ca09f98656bbb711eb","kind":"canonical_kernel","source_path":"AGENTS.md","source_revision":"58b21338c0378a2f8ea8e955979eaa5041ac098e"},"object_kind":"portfolio_manifest","portfolio_id":"ask.portfolio.issue278.sample-evaluation","registry":{"registry_id":"ask-local-assets","repository_id":"github.com/ist-h-i/agent-spectrum-kernel","scope_id":"agent-spectrum-kernel","snapshot_digest":"sha256:bed19f2c11e147262fb211ff162c590834f1f1d5f40f66b8e0a12e1caed4f801","snapshot_revision":6},"repository_id":"github.com/ist-h-i/agent-spectrum-kernel","revision":"sample-challenger-v1","rollback":{"mode":"none","required_authority_kind":"external_portfolio_rollback_authority","target":null},"safety_guardrails":{"high_impact_without_approval_action":"stop","prohibited_effects":[],"unknown_safety_action":"downgrade"},"schema_version":"1.0.0","scope_id":"agent-spectrum-kernel","selection_basis_digest":"sha256:701400bbeb4b78ef446ab82faf97aa8800387a0a0b85345b73887fa8292be33a","selection_context_allowlist":{"adapters":["codex"],"capabilities":["repository.read"],"domains":["software-engineering"],"models":["gpt-5.6-sol"],"operation_scopes":["local_repository"],"projects":["github.com/ist-h-i/agent-spectrum-kernel"],"risk_classes":["normal"],"stacks":["node"],"task_classes":["implementation"]},"selection_policy":{"empty_selection_action":"stop","portfolio_inapplicable_action":"bypass","selector_conflict_action":"stop"},"selectors":{"adapters":{"excluded":[],"included":["codex"],"status":"bounded"},"capabilities":{"excluded":[],"included":["repository.read"],"status":"bounded"},"domains":{"excluded":[],"included":["software-engineering"],"status":"bounded"},"models":{"excluded":[],"included":["gpt-5.6-sol"],"status":"bounded"},"projects":{"excluded":[],"included":["github.com/ist-h-i/agent-spectrum-kernel"],"status":"bounded"},"risk_classes":{"excluded":[],"included":["normal"],"status":"bounded"},"stacks":{"excluded":[],"included":["node"],"status":"bounded"},"task_classes":{"excluded":[],"included":["implementation"],"status":"bounded"}},"source_revision":"58b21338c0378a2f8ea8e955979eaa5041ac098e","unresolved_conflicts":[]}
